{
  "playbook_file": "fintech-and-payments.prompt.md",
  "version": "v1",
  "generated_at": "2026-03-03",
  "section_count": 6,
  "sections": [
    {
      "id": "A",
      "title": "Foundational Synthesis — Business Model & Competitive Positioning",
      "required_elements": [
        "Payment rail classification and revenue mix breakdown",
        "Total Payable Volume (TPV) growth and take-rate benchmarking",
        "Competitive moat assessment (network effects, regulatory licenses, switching costs)",
        "Geographic and vertical revenue concentration analysis"
      ]
    },
    {
      "id": "B",
      "title": "Take-Rate & Unit Economics Bridge",
      "required_elements": [
        "Take-rate trend analysis and compression drivers",
        "Net Revenue Retention (NRR) and customer expansion metrics",
        "Gross margin bridge and credit loss modeling",
        "Rule of 40 efficiency analysis vs. peers"
      ]
    },
    {
      "id": "C",
      "title": "Regulatory & Compliance Moat",
      "required_elements": [
        "License inventory and CFPB oversight risk assessment",
        "Basel III and bank charter capital requirement analysis",
        "Interchange regulation and revenue impact modeling",
        "Crypto/stablecoin exposure and policy risk quantification"
      ]
    },
    {
      "id": "D",
      "title": "Financial Logic & Valuation",
      "required_elements": [
        "EV/TPV multiple benchmarking and justification",
        "Adjusted EBITDA and FCF margin progression modeling",
        "SaaS/platform component EV/Revenue application",
        "Credit risk premium and leverage-adjusted WACC for BNPL/lending"
      ]
    },
    {
      "id": "E",
      "title": "Pattern Matching & IDP Flagging",
      "required_elements": [
        "Merchant concentration and churn risk monitoring",
        "Credit deterioration and charge-off trend tracking",
        "Regulatory/legal overhang and settlement risk quantification",
        "Crypto and FX exposure impact on reported results"
      ]
    },
    {
      "id": "F",
      "title": "Investigation Tracks",
      "required_elements": [
        "Take-rate resilience under volume and competitive pressure analysis",
        "Profitability pathway and capital intensity modeling",
        "Regulatory moat durability and API commoditization risk assessment"
      ]
    }
  ],
  "structural_requirements": [
    "Opinion block present",
    "Summary for Perspectives present",
    "All financial claims cited",
    "Investigation tracks specified"
  ]
}
